{
  "$schema": "https://json-schema.org/draft/2020-12/schema",
  "$id": "https://emoji.style/schemas/emoji-styles-config.schema.json",
  "title": "Emoji Styles project configuration",
  "type": "object",
  "additionalProperties": false,
  "required": ["schemaVersion", "provider", "fallbacks", "source"],
  "properties": {
    "$schema": { "type": "string" },
    "schemaVersion": { "const": 1 },
    "provider": { "type": "string", "minLength": 1 },
    "fallbacks": { "type": "array", "items": { "type": "string", "minLength": 1 }, "uniqueItems": true },
    "nativeFallback": { "type": "boolean", "default": true },
    "source": { "type": "array", "items": { "type": "string", "minLength": 1 }, "minItems": 1, "uniqueItems": true },
    "localAssets": {
      "type": "object",
      "additionalProperties": false,
      "required": ["directory", "manifest"],
      "properties": {
        "directory": { "type": "string", "minLength": 1 },
        "manifest": { "type": "string", "minLength": 1 }
      }
    },
    "semanticTokens": { "type": "string", "minLength": 1 },
    "policy": {
      "type": "object",
      "additionalProperties": false,
      "properties": {
        "allowRemoteAssets": { "type": "boolean" },
        "audit": {
          "type": "object",
          "propertyNames": {
            "enum": [
              "emoji-styles/semantic/raw-emoji",
              "emoji-styles/accessibility/missing-label",
              "emoji-styles/determinism/native-critical-ui",
              "emoji-styles/provider/direct-url",
              "emoji-styles/provider/unpinned-url",
              "emoji-styles/provider/unknown",
              "emoji-styles/provider/missing-fallback",
              "emoji-styles/provider/remote-forbidden",
              "emoji-styles/provider/custom-asset-bypass",
              "emoji-styles/provider/invalid-manifest",
              "emoji-styles/provider/missing-hash",
              "emoji-styles/licensing/missing-provider-license",
              "emoji-styles/unicode/unsupported-sequence",
              "emoji-styles/parser/invalid-source"
            ]
          },
          "additionalProperties": { "enum": ["off", "info", "warning", "error"] }
        }
      }
    }
  }
}
